<?xml version="1.0" encoding="UTF-8"?>
<!DOCTYPE libros SYSTEM "libros.dtd">
<libros>
    <libro1 isbn="">
        <titulo1></titulo1>
        <precio1></precio1>
    </libro1>
    <libro2 isbn="">
        <titulo2></titulo2>
        <autores>
            <autor1></autor1>
            <autor2></autor2>
        </autores>
        <precio2></precio2>
    </libro2>
    <libro3 isbn="">
        <titulo3></titulo3>
        <autor3></autor3>
        <precio3></precio3>
    </libro3>
    <libro4 isbn="">
        <titulo4></titulo4>
        <autor4></autor4>
        <precios>
            <precios1></precios1>
            <precios2></precios2>
        </precios>
    </libro4>
    <libro5 isbn="">
        <titulo5></titulo5>
        <autor5></autor5>
        <precio5></precio5>
    </libro5>
</libros>